incident,location,support,source
"A pipeline burst in South District has left four lanes without clean drinking water since early morning. Families need tanker delivery, storage containers, and field coordination.",South District,"Water tankers, storage containers, field coordination",Ward volunteer hotline
"Hand pumps in North Point stopped working overnight. Children and elderly residents need immediate water delivery and purification support.",North Point,"Water delivery, purification tablets, transport",Field note from ward volunteer
"A food distribution drive in West End is running short on ration packets for migrant workers. The field team needs procurement help, packaging volunteers, and crowd coordination.",West End,"Ration packets, packaging volunteers, crowd coordination",Field operations spreadsheet
"Families in East Market report no access to clean water for 48 hours after supply disruption. Emergency water tankers and distribution volunteers needed urgently.",East Market,"Emergency water tankers, distribution volunteers",Community hotline
"Ration shortage reported in Central Ward after supply chain delay. Low-income families need dry food kits, cooking oil, and distribution support.",Central Ward,"Dry food kits, cooking oil, distribution support",NGO partner survey
