incident,location,support,source
"A community health camp in Central Ward is facing long queues after a dengue screening drive. Volunteers are needed for patient registration, medicine desk support, and elderly assistance.",Central Ward,"Registration support, medicine desk, elderly assistance",NGO outreach coordinator
"A mobile vaccination drive in South District needs additional volunteers to manage crowd flow, assist with documentation, and support elderly and disabled residents.",South District,"Crowd management, documentation support, mobility assistance",Health department field note
"The free eye-check camp at West End clinic is overwhelmed with patients. Volunteers with basic medical training are needed for pre-screening, queue management, and transport coordination.",West End,"Pre-screening support, queue management, transport coordination",Clinic coordinator report
"A mental health awareness camp in North Point needs trained volunteers for one-on-one counselling support sessions and distribution of resource booklets to attendees.",North Point,"Counselling support, resource distribution, session coordination",Mental health NGO referral
"Post-flood health screening in Riverside Zone has identified 30+ residents needing follow-up care. Volunteers are needed to coordinate home visits and medicine delivery for elderly patients.",Riverside Zone,"Home visit coordination, medicine delivery, follow-up tracking",Field health worker report
